{
  "$defs": {
    "axis": {
      "additionalProperties": false,
      "properties": {
        "axis_name": {
          "pattern": "^[a-z][a-z0-9_]{1,63}$",
          "type": "string"
        },
        "values": {
          "items": {
            "type": [
              "string",
              "integer"
            ]
          },
          "maxItems": 5,
          "minItems": 4,
          "type": "array",
          "uniqueItems": true
        }
      },
      "required": [
        "axis_name",
        "values"
      ],
      "type": "object"
    },
    "sha256": {
      "pattern": "^[0-9a-f]{64}$",
      "type": "string"
    }
  },
  "$id": "https://cbds.invalid/schemas/executable-method-development-coverage-migration.schema.json",
  "$schema": "https://json-schema.org/draft/2020-12/schema",
  "$comment": "This schema checks the public migration shape and frozen principal identities. Exact migration admission additionally requires cbds.executable_development_coverage_migration.load_executable_development_coverage_migration, which compares canonical bytes with live v1/v2 evidence.",
  "additionalProperties": false,
  "properties": {
    "candidate_execution_authorized": {
      "const": false
    },
    "changed_family_count": {
      "const": 1
    },
    "changed_family_id": {
      "const": "hardlink-deduplicated-mirror"
    },
    "claim_authorized": {
      "const": false
    },
    "discrimination_sha256": {
      "const": "1a0c0d23bb262c1d94250a92574c89af6c6333da08d58be715e1b5d1f4940435"
    },
    "from": {
      "additionalProperties": false,
      "properties": {
        "config_byte_count": {
          "const": 22495
        },
        "config_bytes_sha256": {
          "const": "46f98f54ef5682ce0adc3854557ecfe8ed092fd5e916935bc27702edb4e86efa"
        },
        "config_relative_path": {
          "const": "configs/executable-method-development-coverage-v1.json"
        },
        "coverage_sha256": {
          "const": "6c215d9eaf5581aaa146d6814a9d40621a57459c5af98ae4ca625caff10c9c8c"
        },
        "coverage_version": {
          "const": "1.0.0"
        },
        "git_commit": {
          "const": "32a703fca7b0b55357cc66ed90f67e83e390025d"
        }
      },
      "required": [
        "coverage_version",
        "coverage_sha256",
        "config_relative_path",
        "config_bytes_sha256",
        "config_byte_count",
        "git_commit"
      ],
      "type": "object"
    },
    "migration_sha256": {
      "const": "eb2b577e8449438c734174f361dea5c2c1ced9a3a68be383413dc6e727b8526f"
    },
    "migration_version": {
      "const": "1.0.0"
    },
    "model_selection_eligible": {
      "const": false
    },
    "new_family_sha256": {
      "const": "e5220935eae1a67271733903252629df7b71a3fb01cc116ad9d86ce5e12738cc"
    },
    "new_lifecycle_state": {
      "const": "integrated"
    },
    "new_parameter_axes": {
      "const": [
        {
          "axis_name": "equivalence_key",
          "values": [
            "sha256",
            "mode-and-sha256",
            "suffix-and-sha256",
            "declared-group-and-sha256"
          ]
        },
        {
          "axis_name": "owner_policy",
          "values": [
            "smallest-path",
            "largest-path",
            "oldest-mtime",
            "newest-mtime",
            "manifest-priority"
          ]
        }
      ]
    },
    "new_task_set_sha256": {
      "const": "0415daa5f9bccfcd75b621ef4ae71c9e79a5b7c19763ceb470e5ef21169706d1"
    },
    "old_family_sha256": {
      "const": "962199c9d4bebf6fd7dee376d05e75d4b82b0b9bfd82221b2fceb378fba00ff1"
    },
    "old_lifecycle_state": {
      "const": "planned"
    },
    "old_parameter_axes": {
      "const": [
        {
          "axis_name": "equivalence_key",
          "values": [
            "sha256",
            "size-and-sha256",
            "mode-and-sha256",
            "declared-content-id"
          ]
        },
        {
          "axis_name": "link_policy",
          "values": [
            "smallest-path-owner",
            "first-discovered-owner",
            "preserve-existing-groups",
            "regular-files-only",
            "reject-cross-mode-group"
          ]
        }
      ]
    },
    "public_method_development": {
      "const": true
    },
    "reason_codes": {
      "const": [
        "redundant-equivalence-key",
        "nondeterministic-discovery-order",
        "nonorthogonal-link-policy",
        "implemented-grid-discrimination",
        "ninth-tranche-integration"
      ]
    },
    "record_type": {
      "const": "cbds.executable-method-development-coverage-migration"
    },
    "schema_version": {
      "const": "1.0.0"
    },
    "scored": {
      "const": false
    },
    "scored_evaluation_authorized": {
      "const": false
    },
    "sealed": {
      "const": false
    },
    "to": {
      "additionalProperties": false,
      "properties": {
        "config_relative_path": {
          "const": "configs/executable-method-development-coverage-v2.json"
        },
        "coverage_sha256": {
          "const": "7406480a1dc06bc99d1e36fde1a328a490d6cc8d6b96ee38c924a902acbf9abd"
        },
        "coverage_version": {
          "const": "2.0.0"
        }
      },
      "required": [
        "coverage_version",
        "coverage_sha256",
        "config_relative_path"
      ],
      "type": "object"
    },
    "unchanged_family_count": {
      "const": 24
    },
    "unchanged_family_sha256": {
      "items": {
        "$ref": "#/$defs/sha256"
      },
      "maxItems": 24,
      "minItems": 24,
      "type": "array",
      "uniqueItems": true
    }
  },
  "required": [
    "schema_version",
    "migration_version",
    "record_type",
    "from",
    "to",
    "changed_family_count",
    "unchanged_family_count",
    "changed_family_id",
    "old_lifecycle_state",
    "new_lifecycle_state",
    "old_family_sha256",
    "new_family_sha256",
    "old_parameter_axes",
    "new_parameter_axes",
    "new_task_set_sha256",
    "discrimination_sha256",
    "reason_codes",
    "unchanged_family_sha256",
    "migration_sha256",
    "public_method_development",
    "sealed",
    "scored",
    "candidate_execution_authorized",
    "scored_evaluation_authorized",
    "model_selection_eligible",
    "claim_authorized"
  ],
  "title": "CBDS executable development coverage v1-to-v2 migration",
  "type": "object"
}
