{"candidate_execution_authorized":false,"changed_family_count":1,"changed_family_id":"hardlink-deduplicated-mirror","claim_authorized":false,"discrimination_sha256":"1a0c0d23bb262c1d94250a92574c89af6c6333da08d58be715e1b5d1f4940435","from":{"config_byte_count":22495,"config_bytes_sha256":"46f98f54ef5682ce0adc3854557ecfe8ed092fd5e916935bc27702edb4e86efa","config_relative_path":"configs/executable-method-development-coverage-v1.json","coverage_sha256":"6c215d9eaf5581aaa146d6814a9d40621a57459c5af98ae4ca625caff10c9c8c","coverage_version":"1.0.0","git_commit":"32a703fca7b0b55357cc66ed90f67e83e390025d"},"migration_sha256":"eb2b577e8449438c734174f361dea5c2c1ced9a3a68be383413dc6e727b8526f","migration_version":"1.0.0","model_selection_eligible":false,"new_family_sha256":"e5220935eae1a67271733903252629df7b71a3fb01cc116ad9d86ce5e12738cc","new_lifecycle_state":"integrated","new_parameter_axes":[{"axis_name":"equivalence_key","values":["sha256","mode-and-sha256","suffix-and-sha256","declared-group-and-sha256"]},{"axis_name":"owner_policy","values":["smallest-path","largest-path","oldest-mtime","newest-mtime","manifest-priority"]}],"new_task_set_sha256":"0415daa5f9bccfcd75b621ef4ae71c9e79a5b7c19763ceb470e5ef21169706d1","old_family_sha256":"962199c9d4bebf6fd7dee376d05e75d4b82b0b9bfd82221b2fceb378fba00ff1","old_lifecycle_state":"planned","old_parameter_axes":[{"axis_name":"equivalence_key","values":["sha256","size-and-sha256","mode-and-sha256","declared-content-id"]},{"axis_name":"link_policy","values":["smallest-path-owner","first-discovered-owner","preserve-existing-groups","regular-files-only","reject-cross-mode-group"]}],"public_method_development":true,"reason_codes":["redundant-equivalence-key","nondeterministic-discovery-order","nonorthogonal-link-policy","implemented-grid-discrimination","ninth-tranche-integration"],"record_type":"cbds.executable-method-development-coverage-migration","schema_version":"1.0.0","scored":false,"scored_evaluation_authorized":false,"sealed":false,"to":{"config_relative_path":"configs/executable-method-development-coverage-v2.json","coverage_sha256":"7406480a1dc06bc99d1e36fde1a328a490d6cc8d6b96ee38c924a902acbf9abd","coverage_version":"2.0.0"},"unchanged_family_count":24,"unchanged_family_sha256":["ee5c8d54a558bf363551c1be6fe890516ec771125dacea18a3a6a02e69c74883","eedccb0e40222cb86fa56dd0afdbe8fbc13c68f1e91ab9d0c14133da394249aa","26fb05b0647db40ad03a87bed6872fa1e5c0cf62bb512fb0413b19294e5d0270","1929ab3d395d5919782444c6f821edf6e7728169fdeb1418d8d46f7e94db8ad5","fe784471ec4f71b6f90f7e69ba19c1d4dfa1323a1ba33e15221f71198dd447f9","72857e1eb6c7b6b5f38b861d032fc926b3c37c6e4b64359f72efa07a247aa647","778508feae91eafcc6b7e7d0e80d3c8f13213310b6a0ac878f07e11d577a7304","ef617cabdae067df2c1af55172d6984239658ff8adf90b98b3caf9ba6f3c5f82","f623d663732550cdd36c8f72faf8f7c87d30eb1c3949595371b2570eef46b322","539fd216fe143776a5e07681a8f8a5331ca6ba5aca472779abc7693f226f8578","6f6c2e9c86b65f230694af38803a4b81a4d5bceb88079f1418144b69a3a0b7a1","d7b12323e97ecc07544bd913008157e0d965cb97df5a845db4b404f1220cebd0","0996f74065c1a6b0d567099cb6d8e0a2622f73c962ed7ae64583f31e111fc042","ece3f2b9da802cea801dc9272695f7dc82bf4901c8b2c4da5eabfbf4562b7fb8","6763260f60cc7b9cd92559dd2db9f17c39a7b51a2f59dcec3747622edbb73941","7d1fd358167f58131e86548a53e30e49f17d7ef4a12d2ac7aeccab961ee0200a","97629e67865cb4e2275f64dfd56ffc85b9eb51bff79c3508595c9ce3166e4f99","8138a4dbf70dce775100b28658468da7bfbb6c1a2ee97ac24b6794011a09d3ab","8261a719e2afa702509ca16656760eed89f55c121667db0531a94168476f1bf9","bc13048228af8c3f819275855bfd9b9a0da76bd3b59fe3509382037ea7bf0441","a2d00fd23b913baf301a992340d1373352f8f4cd95a954922af14eecaced5db9","4711a638d7d4f674701a9e90c7266d1d8a8c00c00c149757820314dd85beec7b","b7f590855836e878258829209e707f3b1b4c00bdc22d6352c65ce3e7f4f88c46","daa5a4e0018acdfe6da7ac684574f735313cc14daf1617fd95226f847c133959"]}
